{
  "schemaVersion": 1,
  "pluginId": "com.folderrewind.minerewind",
  "version": "1.10.0",
  "channel": "stable",
  "pluginApi": {
    "major": 3,
    "minor": 17
  },
  "architectures": [
    "any"
  ],
  "artifact": {
    "sha256": "57795c25ea71a460f686419983d91a2f5f45eb7a48e31eab40261a8198d6df0d",
    "url": "https://github.com/Leafuke/FolderRewind-Plugin-Minecraft/releases/download/1.10.0/MineRewind-1.10.0.frplugin"
  },
  "provenance": "officialCatalog",
  "trustClassification": "official",
  "requestedHostServices": [
    "configQuery",
    "backupRequest",
    "restoreRequest",
    "historyQuery",
    "knotLink",
    "temporaryStorage",
    "logging",
    "artifactRead",
    "artifactTransformStaging",
    "restoreMaterializationWorkspace"
  ],
  "artifactFormats": [
    "minecraft-world-full",
    "minecraft-world-incremental"
  ],
  "artifactTransformers": [
    "minecraft-world-full"
  ],
  "restoreStrategies": [
    "minecraft-world-materializer"
  ],
  "futureSignature": null
}
